{"schema_version":1,"source":"arm","region":"centralindia","kind":"seed","observed_at":"2026-10-27T19:30:00Z","observed_from":"standard pay-as-you-go subscription","entry_count":10,"cell_count":10,"snapshot_sha256":"e0e5a3c6510652f1a663f63c772f09f52431226adc77fefd87ae93ff608dca51","entries":[{"model_key":"gpt-4.1-mini@2025-04-14","first_seen":"2026-10-27T19:30:00Z","last_seen":"2026-10-27T19:30:00Z","watched":{"name":"gpt-4.1-mini","version":"2025-04-14","format":"OpenAI","lifecycle_status":"Legacy","lifecycle_portal":"Legacy","deprecation_inference":"2027-04-14T00:00:00Z","deprecation_fine_tune":"2027-04-14T00:00:00Z","is_default_version":true,"capabilities":{"FineTuneTokensMaxValue":"2000000000","FineTuneTokensMaxValuePerExample":"65536","agentsV2":"true","assistants":"true","chatCompletion":"true","responses":"true"},"skus":[{"name":"GlobalProvisionedManaged","deprecation_date":"2027-04-14T00:00:00Z"}]},"cells":[{"deployment_type":"GlobalProvisionedManaged","first_seen":"2026-10-27T19:30:00Z","last_seen":"2026-10-27T19:30:00Z","removed_at":null,"sku_deprecation_date":"2027-04-14T00:00:00Z","capacity":null,"capacity_at":null}]},{"model_key":"gpt-4.1-nano@2025-04-14","first_seen":"2026-10-27T19:30:00Z","last_seen":"2026-10-27T19:30:00Z","watched":{"name":"gpt-4.1-nano","version":"2025-04-14","format":"OpenAI","lifecycle_status":"Legacy","lifecycle_portal":"Legacy","deprecation_inference":"2027-04-14T00:00:00Z","deprecation_fine_tune":"2027-04-14T00:00:00Z","is_default_version":true,"capabilities":{"FineTuneTokensMaxValue":"2000000000","FineTuneTokensMaxValuePerExample":"32768","agentsV2":"true","assistants":"true","chatCompletion":"true","responses":"true"},"skus":[{"name":"GlobalProvisionedManaged","deprecation_date":"2027-04-14T00:00:00Z"}]},"cells":[{"deployment_type":"GlobalProvisionedManaged","first_seen":"2026-10-27T19:30:00Z","last_seen":"2026-10-27T19:30:00Z","removed_at":null,"sku_deprecation_date":"2027-04-14T00:00:00Z","capacity":null,"capacity_at":null}]},{"model_key":"gpt-4.1@2025-04-14","first_seen":"2026-10-27T19:30:00Z","last_seen":"2026-10-27T19:30:00Z","watched":{"name":"gpt-4.1","version":"2025-04-14","format":"OpenAI","lifecycle_status":"Legacy","lifecycle_portal":"Legacy","deprecation_inference":"2027-04-14T00:00:00Z","deprecation_fine_tune":"2027-04-14T00:00:00Z","is_default_version":true,"capabilities":{"FineTuneTokensMaxValue":"2000000000","FineTuneTokensMaxValuePerExample":"65536","agentsV2":"true","assistants":"true","chatCompletion":"true","priorityTierSkus":"GlobalStandard","responses":"true"},"skus":[{"name":"GlobalProvisionedManaged","deprecation_date":"2027-04-14T00:00:00Z"}]},"cells":[{"deployment_type":"GlobalProvisionedManaged","first_seen":"2026-10-27T19:30:00Z","last_seen":"2026-10-27T19:30:00Z","removed_at":null,"sku_deprecation_date":"2027-04-14T00:00:00Z","capacity":null,"capacity_at":null}]},{"model_key":"gpt-4o-mini@2024-07-18","first_seen":"2026-10-27T19:30:00Z","last_seen":"2026-10-27T19:30:00Z","watched":{"name":"gpt-4o-mini","version":"2024-07-18","format":"OpenAI","lifecycle_status":"Deprecating","lifecycle_portal":"Deprecated","deprecation_inference":"2027-04-14T00:00:00Z","deprecation_fine_tune":"2027-04-14T00:00:00Z","is_default_version":true,"capabilities":{"FineTuneTokensMaxValue":"2000000000","FineTuneTokensMaxValuePerExample":"131072","agentsV2":"true","allowProvisionedManagedCommitment":"true","assistants":"true","chatCompletion":"true","jsonObjectResponse":"true","maxContextToken":"128000","maxOutputToken":"16384","responses":"true"},"skus":[{"name":"GlobalProvisionedManaged","deprecation_date":"2027-04-14T00:00:00Z"}]},"cells":[{"deployment_type":"GlobalProvisionedManaged","first_seen":"2026-10-27T19:30:00Z","last_seen":"2026-10-27T19:30:00Z","removed_at":null,"sku_deprecation_date":"2027-04-14T00:00:00Z","capacity":null,"capacity_at":null}]},{"model_key":"gpt-4o@2024-05-13","first_seen":"2026-10-27T19:30:00Z","last_seen":"2026-10-27T19:30:00Z","watched":{"name":"gpt-4o","version":"2024-05-13","format":"OpenAI","lifecycle_status":"Deprecating","lifecycle_portal":"Deprecated","deprecation_inference":"2026-12-09T00:00:00Z","deprecation_fine_tune":"2026-12-09T00:00:00Z","is_default_version":false,"capabilities":{"FineTuneTokensMaxValue":"2000000000","FineTuneTokensMaxValuePerExample":"131072","agentsV2":"true","allowProvisionedManagedCommitment":"true","assistants":"true","chatCompletion":"true","jsonObjectResponse":"true","maxContextToken":"128000","maxOutputToken":"4096","responses":"true"},"skus":[{"name":"GlobalProvisionedManaged","deprecation_date":"2026-12-09T00:00:00Z"}]},"cells":[{"deployment_type":"GlobalProvisionedManaged","first_seen":"2026-10-27T19:30:00Z","last_seen":"2026-10-27T19:30:00Z","removed_at":null,"sku_deprecation_date":"2026-12-09T00:00:00Z","capacity":null,"capacity_at":null}]},{"model_key":"gpt-4o@2024-08-06","first_seen":"2026-10-27T19:30:00Z","last_seen":"2026-10-27T19:30:00Z","watched":{"name":"gpt-4o","version":"2024-08-06","format":"OpenAI","lifecycle_status":"Deprecating","lifecycle_portal":"Deprecated","deprecation_inference":"2027-04-14T00:00:00Z","deprecation_fine_tune":"2027-04-14T00:00:00Z","is_default_version":false,"capabilities":{"FineTuneTokensMaxValue":"2000000000","FineTuneTokensMaxValuePerExample":"131072","agentsV2":"true","allowProvisionedManagedCommitment":"true","assistants":"true","chatCompletion":"true","jsonSchemaResponse":"true","maxContextToken":"128000","maxOutputToken":"16384","responses":"true"},"skus":[{"name":"GlobalProvisionedManaged","deprecation_date":"2027-04-14T00:00:00Z"}]},"cells":[{"deployment_type":"GlobalProvisionedManaged","first_seen":"2026-10-27T19:30:00Z","last_seen":"2026-10-27T19:30:00Z","removed_at":null,"sku_deprecation_date":"2027-04-14T00:00:00Z","capacity":null,"capacity_at":null}]},{"model_key":"gpt-4o@2024-11-20","first_seen":"2026-10-27T19:30:00Z","last_seen":"2026-10-27T19:30:00Z","watched":{"name":"gpt-4o","version":"2024-11-20","format":"OpenAI","lifecycle_status":"Legacy","lifecycle_portal":"Legacy","deprecation_inference":"2027-04-14T00:00:00Z","deprecation_fine_tune":null,"is_default_version":true,"capabilities":{"agentsV2":"true","allowProvisionedManagedCommitment":"true","assistants":"true","chatCompletion":"true","jsonSchemaResponse":"true","responses":"true"},"skus":[{"name":"GlobalProvisionedManaged","deprecation_date":"2027-04-14T00:00:00Z"}]},"cells":[{"deployment_type":"GlobalProvisionedManaged","first_seen":"2026-10-27T19:30:00Z","last_seen":"2026-10-27T19:30:00Z","removed_at":null,"sku_deprecation_date":"2027-04-14T00:00:00Z","capacity":null,"capacity_at":null}]},{"model_key":"o1@2024-12-17","first_seen":"2026-10-27T19:30:00Z","last_seen":"2026-10-27T19:30:00Z","watched":{"name":"o1","version":"2024-12-17","format":"OpenAI","lifecycle_status":"Deprecating","lifecycle_portal":"Deprecated","deprecation_inference":"2026-11-19T00:00:00Z","deprecation_fine_tune":null,"is_default_version":true,"capabilities":{"agentsV2":"true","assistants":"true","chatCompletion":"true","responses":"true"},"skus":[{"name":"GlobalProvisionedManaged","deprecation_date":"2026-11-19T00:00:00Z"}]},"cells":[{"deployment_type":"GlobalProvisionedManaged","first_seen":"2026-10-27T19:30:00Z","last_seen":"2026-10-27T19:30:00Z","removed_at":null,"sku_deprecation_date":"2026-11-19T00:00:00Z","capacity":null,"capacity_at":null}]},{"model_key":"o4-mini@2025-04-16","first_seen":"2026-10-27T19:30:00Z","last_seen":"2026-10-27T19:30:00Z","watched":{"name":"o4-mini","version":"2025-04-16","format":"OpenAI","lifecycle_status":"Deprecating","lifecycle_portal":"Deprecated","deprecation_inference":"2026-11-19T00:00:00Z","deprecation_fine_tune":"2026-11-19T00:00:00Z","is_default_version":true,"capabilities":{"FineTuneTokensMaxValue":"2000000000","FineTuneTokensMaxValuePerExample":"131072","agentsV2":"true","assistants":"false","chatCompletion":"true","responses":"true"},"skus":[{"name":"GlobalProvisionedManaged","deprecation_date":"2026-11-19T00:00:00Z"}]},"cells":[{"deployment_type":"GlobalProvisionedManaged","first_seen":"2026-10-27T19:30:00Z","last_seen":"2026-10-27T19:30:00Z","removed_at":null,"sku_deprecation_date":"2026-11-19T00:00:00Z","capacity":null,"capacity_at":null}]},{"model_key":"whisper@001","first_seen":"2026-10-27T19:30:00Z","last_seen":"2026-10-27T19:30:00Z","watched":{"name":"whisper","version":"001","format":"OpenAI","lifecycle_status":"GenerallyAvailable","lifecycle_portal":"Generally Available","deprecation_inference":"2026-12-15T00:00:00Z","deprecation_fine_tune":null,"is_default_version":true,"capabilities":{"audio":"true","audioTranscriptions":"true","audioTranslations":"true","scaleType":"Standard"},"skus":[]},"cells":[{"deployment_type":"none","first_seen":"2026-10-27T19:30:00Z","last_seen":"2026-10-27T19:30:00Z","removed_at":null,"sku_deprecation_date":null,"capacity":null,"capacity_at":null}]}]}
